{
  "schema_version": "0.1",
  "generated_at": "2026-07-23T00:00:00+07:00",
  "source_scope": "public_first_party_only",
  "services": [
    {
      "candidate_id": "education-edupia-oa",
      "name": "Edupia",
      "provider": "Công ty Cổ phần Giáo dục Educa Corporation",
      "channel_type": "oa",
      "category": "education",
      "subcategory": "online_english_learning",
      "description": "Nền tảng học tiếng Anh trực tuyến cho học sinh từ 6 đến 15 tuổi, gồm chương trình tự học và gia sư online. OA công khai được website Edupia liên kết và Zalo liệt kê trong danh sách đối tác.",
      "launch_url": "https://zalo.me/3359099682314876895",
      "official_website": "https://edupia.vn/",
      "logo_url": "https://stc-oa.zdn.vn/resources/zoa-landing/images/home/partner_v4/edu.png",
      "regions": [
        "Trực tuyến toàn quốc, Việt Nam"
      ],
      "target_users": [
        "Học sinh từ 6 đến 15 tuổi",
        "Học sinh tiểu học và trung học cơ sở",
        "Phụ huynh cần theo dõi và hỗ trợ việc học"
      ],
      "capabilities": [
        "Học tiếng Anh trực tuyến",
        "Chương trình tự học",
        "Gia sư tiếng Anh online",
        "Luyện nghe, nói, đọc và viết",
        "Theo dõi kết quả học tập"
      ],
      "aliases": [
        "EDUPIA",
        "Edupia AI",
        "Edupia Pro",
        "tiếng Anh online cho trẻ"
      ],
      "intents": [
        {
          "intent": "find_online_english_course",
          "example_queries": [
            "Tìm khóa học tiếng Anh online cho bé lớp 5",
            "Con tôi 10 tuổi muốn học tiếng Anh",
            "Tìm ứng dụng luyện phát âm cho học sinh"
          ]
        },
        {
          "intent": "get_education_support",
          "example_queries": [
            "Tư vấn khóa học Edupia",
            "Tôi muốn nhận kết quả học của con qua Zalo",
            "Tìm gia sư tiếng Anh online"
          ]
        }
      ],
      "evidence": [
        {
          "url": "https://edupia.vn/about-us",
          "publisher": "Edupia",
          "supports": [
            "Trang giới thiệu chính thức mô tả chương trình học online, đối tượng 6-15 tuổi, sản phẩm tự học và gia sư; footer liên kết đúng OA."
          ],
          "checked_at": "2026-07-23"
        },
        {
          "url": "https://oa.zalo.me/home",
          "publisher": "Zalo Official Account",
          "supports": [
            "Dữ liệu PARTNERS trên trang Zalo OA chính thức liệt kê Edupia với launch URL và logo tham chiếu tương ứng."
          ],
          "checked_at": "2026-07-23"
        },
        {
          "url": "https://oa.zalo.me/3359099682314876895",
          "publisher": "Edupia trên Zalo",
          "supports": [
            "Đường dẫn OA được website Edupia chính chủ công khai liên kết và trả về nội dung công khai."
          ],
          "checked_at": "2026-07-23"
        }
      ],
      "verification": {
        "official_source": true,
        "link_reachable": true,
        "cross_linked": true,
        "oa_badge_status": "unknown",
        "confidence": "high",
        "notes": "Website chính chủ và danh sách đối tác Zalo cùng trỏ tới một OA. Chưa quan sát trực tiếp dấu xác minh trên giao diện OA."
      },
      "active": false,
      "review_status": "candidate",
      "logo_usage": "reference_only_needs_review",
      "cta_label": "Mở OA",
      "organization_contexts": []
    },
    {
      "candidate_id": "education-monkey-math-web",
      "name": "Monkey Math",
      "provider": "Công ty Cổ phần Early Start",
      "channel_type": "website",
      "category": "education",
      "subcategory": "primary_math_in_english",
      "description": "Ứng dụng học Toán bằng tiếng Anh theo chương trình giáo dục phổ thông cho trẻ mầm non và tiểu học, sử dụng hình ảnh và trò chơi tương tác để phát triển tư duy toán học.",
      "launch_url": "https://monkey.edu.vn/san-pham/monkey-math",
      "official_website": "https://monkey.edu.vn/",
      "logo_url": "https://vnmedia2.monkeyuni.net/upload/web/storage_web/23-12-2021_16:49:30_MM.png",
      "regions": [
        "Trực tuyến tại Việt Nam"
      ],
      "target_users": [
        "Trẻ mầm non",
        "Học sinh tiểu học",
        "Phụ huynh muốn con học Toán bằng tiếng Anh"
      ],
      "capabilities": [
        "Học Toán bằng tiếng Anh",
        "Nội dung theo chương trình giáo dục phổ thông",
        "Học qua hình ảnh và trò chơi tương tác",
        "Phát triển tư duy logic",
        "Dùng thử và tải ứng dụng"
      ],
      "aliases": [
        "MonkeyMath",
        "Monkey Math App",
        "toán tiếng Anh cho trẻ",
        "ứng dụng học toán tiểu học"
      ],
      "intents": [
        {
          "intent": "learn_primary_math_in_english",
          "example_queries": [
            "Tìm ứng dụng học Toán bằng tiếng Anh cho bé",
            "Con lớp 5 muốn học Toán tiếng Anh",
            "Tìm chương trình Toán cho học sinh tiểu học"
          ]
        },
        {
          "intent": "find_game_based_math_learning",
          "example_queries": [
            "Có app học Toán qua trò chơi không?",
            "Tìm cách giúp bé luyện tư duy logic",
            "Tôi muốn cho con dùng thử Monkey Math"
          ]
        }
      ],
      "evidence": [
        {
          "url": "https://monkey.edu.vn/san-pham/monkey-math",
          "publisher": "Monkey",
          "supports": [
            "Trang sản phẩm chính thức xác nhận đối tượng mầm non và tiểu học, học Toán bằng tiếng Anh, nội dung theo chương trình giáo dục phổ thông, trò chơi tương tác và đơn vị vận hành Early Start."
          ],
          "checked_at": "2026-07-23"
        }
      ],
      "verification": {
        "official_source": true,
        "link_reachable": true,
        "cross_linked": false,
        "oa_badge_status": "not_applicable",
        "confidence": "high",
        "notes": "Chỉ xác minh kênh website; chưa xác minh OA hoặc Mini App. Logo URL là tài sản công khai trên hạ tầng của nhà cung cấp, chỉ dùng làm tham chiếu."
      },
      "active": false,
      "review_status": "candidate",
      "logo_usage": "reference_only_needs_review",
      "cta_label": "Mở dịch vụ",
      "organization_contexts": []
    },
    {
      "candidate_id": "education-olm-web",
      "name": "OLM",
      "provider": "Công ty Cổ phần Khoa học và Công nghệ Giáo dục",
      "channel_type": "website",
      "category": "education",
      "subcategory": "k12_learning_platform",
      "description": "Nền tảng giáo dục số có học liệu tương tác bám sát sách giáo khoa từ mầm non đến lớp 12, hỗ trợ học, luyện đề, hỏi đáp, thi đấu và theo dõi tiến độ.",
      "launch_url": "https://olm.vn/",
      "official_website": "https://olm.vn/",
      "logo_url": "https://olm.vn/images/logo-og-1.jpg",
      "regions": [
        "Trực tuyến toàn quốc, Việt Nam"
      ],
      "target_users": [
        "Học sinh từ mầm non đến lớp 12",
        "Phụ huynh",
        "Giáo viên và nhà trường"
      ],
      "capabilities": [
        "Học liệu Toán, Tiếng Việt, Ngữ văn và Tiếng Anh",
        "Kho bài giảng và bài tập",
        "Hỏi đáp với cộng đồng",
        "Luyện đề và đánh giá năng lực",
        "Theo dõi tiến độ học",
        "Học trực tiếp với giáo viên OLM"
      ],
      "aliases": [
        "OLM.vn",
        "Ô Lờ Mờ",
        "nền tảng OLM",
        "học trực tuyến lớp 5"
      ],
      "intents": [
        {
          "intent": "learn_k12_subject",
          "example_queries": [
            "Tìm khóa học Toán lớp 5",
            "Con tôi cần ôn tập lớp 4 lên lớp 5",
            "Tìm học liệu bám sát sách giáo khoa"
          ]
        },
        {
          "intent": "practice_exam_or_ask_question",
          "example_queries": [
            "Tìm đề kiểm tra Toán lớp 5",
            "Tôi muốn hỏi đáp bài tập",
            "Tìm lớp học trực tiếp với giáo viên"
          ]
        }
      ],
      "evidence": [
        {
          "url": "https://olm.vn/",
          "publisher": "OLM",
          "supports": [
            "Trang chính thức liệt kê học liệu theo khối lớp và môn học, hỏi đáp, kho đề, thi đấu, báo cáo tiến độ, sản phẩm OLM Class và đơn vị vận hành."
          ],
          "checked_at": "2026-07-23"
        },
        {
          "url": "https://class.olm.vn/",
          "publisher": "OLM Class",
          "supports": [
            "Trang chính thức mô tả dịch vụ học trực tiếp với giáo viên, lộ trình học và cập nhật tiến độ cho phụ huynh."
          ],
          "checked_at": "2026-07-23"
        }
      ],
      "verification": {
        "official_source": true,
        "link_reachable": true,
        "cross_linked": false,
        "oa_badge_status": "not_applicable",
        "confidence": "high",
        "notes": "Chỉ xác minh kênh website; footer có biểu tượng Zalo nhưng chưa xác minh đích OA nên không gán channel_type là OA."
      },
      "active": false,
      "review_status": "candidate",
      "logo_usage": "reference_only_needs_review",
      "cta_label": "Mở dịch vụ",
      "organization_contexts": []
    },
    {
      "candidate_id": "education-qanda-web",
      "name": "QANDA",
      "provider": "Mathpresso, Inc.",
      "channel_type": "website",
      "category": "education",
      "subcategory": "ai_homework_help",
      "description": "Dịch vụ hỗ trợ học tập bằng chat và hình ảnh, có tìm kiếm lời giải, lời giải AI theo từng bước và hỏi đáp với giáo viên; cung cấp giao diện tiếng Việt.",
      "launch_url": "https://qanda.ai/vi",
      "official_website": "https://qanda.ai/vi",
      "logo_url": "https://qanda.ai/og-image.png",
      "regions": [
        "Trực tuyến tại Việt Nam"
      ],
      "target_users": [
        "Học sinh cần hỗ trợ làm bài",
        "Người học cần lời giải từng bước",
        "Học sinh cần hỏi giáo viên"
      ],
      "capabilities": [
        "Đặt câu hỏi bằng chat",
        "Chụp ảnh bài tập để tìm lời giải",
        "Lời giải AI theo từng bước",
        "Tìm lời giải tương tự",
        "Hỏi đáp với giáo viên"